{
  "id": "09_romantic_comedy",
  "name": "Romantic Comedy",
  "type": "genre",
  "description": "Romance structured around humor and social friction, typically moving from mismatch and misunderstanding toward commitment or reconciliation. (This graph's constraint definitions are intentionally more detailed than the genre average to capture the nuanced relationship dynamics central to Romantic Comedy.)",
  "nodes": [
    {
      "node_id": "RC_N01_PROMISE",
      "label": "Romantic Comedy Promise",
      "role": "Genre Promise",
      "level": 1,
      "definition": "The audience is promised a love story told through humor, wit, and social friction â€” two people who are wrong for each other (or think they are) will navigate comic obstacles and arrive at romantic union or reconciliation. Both the love story and the comedy are contractual: neither can be dropped without betraying the genre.",
      "entry_conditions": [
        "Story is positioned as romantic comedy"
      ],
      "exit_conditions": [
        "Core constraints are established that guarantee both a romantic arc and a comic arc running simultaneously"
      ],
      "typical_variants": [
        "Screwball romance",
        "Workplace rom-com",
        "Friends-to-lovers",
        "Fake relationship / marriage of convenience"
      ],
      "failure_modes": [
        "Delivers romance without consistent humor â€” becomes melodrama",
        "Delivers humor without genuine romantic feeling â€” becomes pure comedy",
        "Neither romance nor comedy land with sufficient force"
      ],
      "signals_in_text": [
        "Opening establishes both a romantic possibility and a comic obstacle to that possibility",
        "Tone is warm and playful even when characters are in conflict",
        "Audience roots for the couple despite (or because of) their friction"
      ]
    },
    {
      "node_id": "RC_N10_CO_EQUAL_ENGINES",
      "label": "Romance and Humor Must Be Co-Equal Engines",
      "role": "Core Constraint",
      "level": 2,
      "definition": "Neither romance nor comedy may dominate exclusively. The story fails if it becomes so romantic that humor evaporates, or so comedic that genuine feeling is sacrificed. Every major scene should serve both the love story and the comic texture â€” an argument is both funny and emotionally revealing, a misunderstanding both absurd and genuinely threatening to the relationship.",
      "entry_conditions": [
        "Genre promise established"
      ],
      "exit_conditions": [
        "Both romantic longing and comic friction are present and active in the majority of scenes"
      ],
      "typical_variants": [
        "Verbal sparring with undeniable chemistry",
        "Comic situation that forces emotional honesty",
        "Humorous misunderstanding that also deepens genuine stakes",
        "Playful banter that doubles as flirtation"
      ],
      "failure_modes": [
        "Story drifts into straight romance â€” humor becomes occasional relief rather than engine",
        "Story drifts into pure comedy â€” romantic feeling is treated ironically and never believed",
        "Comedy undercuts genuine emotional moments before they can land"
      ],
      "signals_in_text": [
        "Scenes contain at least one laugh and at least one beat of genuine longing or emotional vulnerability",
        "Characters' arguments reveal what they actually want from each other",
        "Audience simultaneously finds moments funny and feels the romantic pull"
      ]
    },
    {
      "node_id": "RC_N11_MISMATCH_BEFORE_UNION",
      "label": "Couple Must Be Mismatched or in Conflict Before Coming Together",
      "role": "Core Constraint",
      "level": 2,
      "definition": "The central couple must begin in a state of mismatch, opposition, or conflict â€” they are from different worlds, hold opposing values, have incompatible goals, or actively dislike each other. This initial friction is the source of both the comedy and the romantic tension. Union is only meaningful if it overcomes genuine incompatibility.",
      "entry_conditions": [
        "Genre promise established",
        "Central couple introduced"
      ],
      "exit_conditions": [
        "Mismatch or conflict is clearly established before any romantic progress is made"
      ],
      "typical_variants": [
        "Class or cultural difference",
        "Professional rivalry or opposing goals",
        "Established antipathy or bad first impression",
        "Incompatible worldviews that generate sustained friction",
        "Forced proximity despite mutual resistance"
      ],
      "failure_modes": [
        "Couple is compatible from the start â€” obstacles are purely external rather than relational",
        "Mismatch is superficial and resolved too quickly to generate sustained comedy or tension",
        "Conflict is so serious that romantic union feels implausible"
      ],
      "signals_in_text": [
        "Early scenes show the couple in opposition or mutual incomprehension",
        "Leads explicitly or implicitly dismiss each other as a romantic possibility",
        "Their differences generate both comic incongruity and genuine dramatic stakes"
      ]
    },
    {
      "node_id": "RC_N12_SOCIAL_FRICTION_SOURCE",
      "label": "Social Friction Generates Both the Comedy and the Obstacles",
      "role": "Core Constraint",
      "level": 2,
      "definition": "In romantic comedy, it is social friction â€” the web of friends, family, coworkers, rivals, and expectations â€” that creates both the humor and the impediments to love. The obstacles are not purely internal (characters' fears) or purely external (circumstance); they are socially generated. Other people complicate, witness, amplify, and ultimately validate the relationship.",
      "entry_conditions": [
        "Genre promise established",
        "Social world around the couple established"
      ],
      "exit_conditions": [
        "At least one major source of socially-generated friction shapes the comic and romantic arcs"
      ],
      "typical_variants": [
        "Disapproving family or friends whose opinion matters",
        "Rival suitors or ex-partners who complicate the field",
        "Social expectations about appropriate partners or behavior",
        "Public humiliation or exposure that raises comic and romantic stakes",
        "Third parties who misread or meddle in the central relationship"
      ],
      "failure_modes": [
        "Couple exists in social isolation â€” no one cares what they do",
        "Friction is purely internal (therapy drama) without comic social dimension",
        "Social world is present but inert â€” characters have no real social stakes"
      ],
      "signals_in_text": [
        "Secondary characters have strong opinions about the central couple",
        "Public or semi-public scenes where social performance is at stake",
        "Misunderstandings travel through the social network and grow",
        "Resolution requires the social world to witness or ratify the union"
      ]
    },
    {
      "node_id": "RC_N13_DUAL_PAYOFF_RESOLUTION",
      "label": "Resolution Must Deliver Both Romantic and Comic Satisfaction",
      "role": "Core Constraint",
      "level": 2,
      "definition": "The ending must pay off both the romantic promise (the couple commits, reconciles, or acknowledges love) and the comic promise (the final obstacle is overcome in a way that is emotionally satisfying and at least somewhat funny or charming). A resolution that is purely romantic (tearful reunion, no comic energy) or purely comedic (laugh at the expense of genuine feeling) fails the genre contract.",
      "entry_conditions": [
        "Comic and romantic arcs established"
      ],
      "exit_conditions": [
        "Story ends with clear romantic union or commitment and at least one final beat that is warm, charming, or witty"
      ],
      "typical_variants": [
        "Grand romantic gesture that is also slightly ridiculous and self-aware",
        "Truth-telling scene that is both honest and comic in its delivery",
        "Final reunion that releases both romantic and comic tension simultaneously",
        "Epilogue showing couple in their new dynamic â€” still playful, clearly together"
      ],
      "failure_modes": [
        "Resolution is purely earnest â€” every comic note is abandoned for sincerity",
        "Resolution is purely comic â€” romance is undercut by irony or joke",
        "Romantic union happens off-screen or is insufficiently dramatized",
        "Comic final obstacle is resolved without romantic acknowledgment"
      ],
      "signals_in_text": [
        "Climax involves both a declaration or gesture of love and a moment of levity",
        "Final scenes show couple together in their natural comic dynamic",
        "Audience leaves feeling both emotionally satisfied and charmed"
      ]
    },
    {
      "node_id": "RC_N20_SCREWBALL",
      "label": "Screwball Romance",
      "role": "Subgenre Pattern",
      "level": 3,
      "definition": "Fast-paced romantic comedy driven by rapid verbal sparring, battle-of-wills dynamics, and social-class friction between the leads. The couple's romantic attraction manifests primarily as conflict â€” they fight because they are drawn to each other, and the audience reads the chemistry beneath the combat. Resolution comes when both characters stop performing superiority and admit desire.",
      "entry_conditions": [
        "Core constraints apply",
        "Leads are both witty and evenly matched",
        "Comic energy is primarily verbal and behavioral rather than situational"
      ],
      "exit_conditions": [
        "Verbal sparring is the dominant comic engine and generates both laughs and romantic tension"
      ],
      "typical_variants": [
        "Class-collision sparring (aristocrat vs. commoner)",
        "Professional rivals forced to collaborate",